title,content,category
"Breakthrough in AI Language Models","Researchers at leading tech companies have developed a new approach to training large language models that reduces computational requirements by 40% while maintaining performance. The technique, called efficient attention mechanisms, promises to make advanced AI more accessible to smaller organizations and researchers. The breakthrough could accelerate AI adoption across industries from healthcare to finance.","AI & Machine Learning"
"Machine Learning Transforms Drug Discovery","Pharmaceutical companies are increasingly turning to machine learning algorithms to identify promising drug candidates. Recent studies show AI-powered screening can reduce drug discovery timelines from years to months. One biotech startup used deep learning to discover a novel antibiotic effective against drug-resistant bacteria, demonstrating the transformative potential of AI in healthcare.","Healthcare & Biotech"
"Quantum Computing Achieves Error Correction Milestone","Scientists have demonstrated a practical quantum error correction system that maintains quantum information for over one second. This represents a thousand-fold improvement over previous attempts and brings fault-tolerant quantum computers significantly closer to reality. The breakthrough could enable quantum simulations of complex molecules for drug design and materials science.","Quantum Computing"
"Major Cybersecurity Vulnerability Discovered in IoT Devices","Security researchers have identified a critical vulnerability affecting millions of Internet of Things devices worldwide. The flaw allows attackers to gain unauthorized access to smart home systems, industrial sensors, and medical devices. Manufacturers are rushing to deploy patches as cybersecurity experts warn of potential widespread exploitation.","Cybersecurity"
"Neural Networks Learn to Generate Realistic 3D Models","A new generative AI system can create detailed 3D models from simple text descriptions, revolutionizing digital content creation. The technology combines natural language processing with advanced computer vision to understand spatial relationships and generate photorealistic objects. Applications range from video game development to architectural visualization and virtual reality experiences.","AI & Machine Learning"
"CRISPR Gene Therapy Shows Promise for Rare Diseases","Clinical trials of CRISPR-based gene therapy have shown remarkable success in treating patients with rare genetic disorders. The treatment permanently corrects disease-causing mutations in patients' DNA, offering hope for cures rather than symptom management. Researchers are now expanding trials to address more common genetic conditions affecting millions worldwide.","Healthcare & Biotech"
"Tech Giants Race to Build Commercial Quantum Computers","Major technology companies are investing billions in quantum computing development, with several announcing plans for commercially available systems within five years. These machines promise to solve optimization problems impossible for classical computers, with applications in logistics, financial modeling, and cryptography. The quantum computing market is projected to reach $65 billion by 2030.","Quantum Computing"
"AI-Powered Threat Detection Prevents Cyberattack","A Fortune 500 company successfully thwarted a sophisticated ransomware attack using AI-powered cybersecurity tools that detected anomalous network behavior in real-time. The system identified the threat 17 minutes after initial infiltration, preventing data encryption and potential millions in losses. This case highlights the growing importance of AI in cybersecurity defense.","Cybersecurity"
"Reinforcement Learning Achieves Superhuman Performance in Complex Strategy Games","AI researchers have developed reinforcement learning algorithms that surpass human experts in strategic decision-making tasks. The system learns optimal strategies through millions of simulated games, discovering novel tactics that human players had never considered. Beyond games, these techniques are being applied to resource allocation, supply chain optimization, and autonomous vehicle navigation.","AI & Machine Learning"
"Personalized Cancer Vaccines Show 90% Success Rate","Biotechnology companies report breakthrough results from personalized cancer vaccine trials, with 90% of patients showing complete tumor regression. The vaccines are custom-designed using AI analysis of each patient's tumor genetics, training the immune system to recognize and destroy cancer cells. This approach represents a paradigm shift from one-size-fits-all treatments to truly personalized medicine.","Healthcare & Biotech"
"Quantum Sensors Enable Unprecedented Medical Imaging","New quantum sensing technology enables medical imaging with 100 times greater resolution than current MRI machines. The sensors exploit quantum entanglement to detect minute magnetic field changes, revealing cellular-level detail in living tissue. Early trials show the technology can detect cancers years before conventional imaging, potentially saving millions of lives through early intervention.","Quantum Computing"
"Zero-Trust Security Architecture Becomes Industry Standard","Organizations worldwide are adopting zero-trust security models that verify every access request regardless of source. This approach assumes no user or device is trustworthy by default, significantly reducing breach risks. Implementation of zero-trust principles has been shown to reduce security incidents by 75% while enabling secure remote work at scale.","Cybersecurity"
"Natural Language Processing Breaks Language Barriers","Advanced NLP systems now provide real-time translation between 200 languages with near-human accuracy. The technology uses transformer architectures and massive multilingual datasets to capture linguistic nuances and cultural context. Applications include international business communication, global education access, and preservation of endangered languages through digital documentation.","AI & Machine Learning"
"Synthetic Biology Creates Programmable Living Cells","Researchers have engineered living cells that can be programmed like computers to perform specific tasks. These biological circuits can sense environmental conditions, make logical decisions, and produce therapeutic proteins on demand. Applications include targeted drug delivery, biomanufacturing of sustainable materials, and environmental monitoring through living sensors.","Healthcare & Biotech"
"Quantum Internet Prototype Demonstrates Secure Communication","Scientists have successfully demonstrated quantum key distribution over a 100-kilometer network, laying groundwork for an unhackable quantum internet. The system uses entangled photons to create encryption keys that reveal any eavesdropping attempts. Governments and financial institutions are investing heavily in quantum communication infrastructure for ultra-secure data transmission.","Quantum Computing"
"Ransomware Attacks Surge 150% Targeting Healthcare Systems","Cybercriminals have intensified ransomware campaigns against hospitals and healthcare providers, exploiting vulnerabilities in medical devices and patient data systems. The attacks have forced facility closures and endangered patient care, prompting emergency cybersecurity measures. Experts attribute the surge to the high value of medical data and institutions' willingness to pay ransoms to restore critical systems.","Cybersecurity"
"Computer Vision AI Achieves Medical Diagnosis Accuracy","Deep learning systems for analyzing medical images now match or exceed radiologist accuracy in detecting diseases. Studies show AI can identify cancers, fractures, and neurological conditions from X-rays, CT scans, and MRIs with 95% accuracy. Integration of these tools in clinical workflows promises to reduce diagnostic errors, speed treatment decisions, and expand access to expert-level medical analysis.","AI & Machine Learning"
"Lab-Grown Organs Reach Clinical Trial Stage","Bioengineered organs grown from patients' own cells have entered human clinical trials, offering hope to thousands awaiting transplants. The organs are created using 3D bioprinting technology that precisely arranges cells and scaffolding materials. Early results show excellent biocompatibility and function, potentially eliminating organ rejection and the need for lifelong immunosuppression.","Healthcare & Biotech"
"Quantum Machine Learning Shows Exponential Advantage","Researchers demonstrate quantum algorithms that solve machine learning problems exponentially faster than classical computers. The quantum advantage appears in tasks like pattern recognition in high-dimensional data and optimization of complex systems. This convergence of quantum computing and AI could revolutionize drug discovery, financial modeling, and climate prediction.","Quantum Computing"
"Biometric Authentication Systems Vulnerable to AI Attacks","Security researchers reveal that advanced AI can generate synthetic biometric data capable of fooling fingerprint and facial recognition systems. The findings raise concerns about the security of biometric authentication, which protects billions of devices and accounts. Industry leaders are developing multi-modal biometric systems and liveness detection to counter AI-powered spoofing attacks.","Cybersecurity"
"Federated Learning Enables Privacy-Preserving AI","New distributed learning techniques allow AI models to train on sensitive data without exposing individual records. Federated learning keeps data on local devices while sharing only model updates, protecting privacy while improving AI performance. Healthcare providers, financial institutions, and tech companies are adopting the approach to leverage collective data while maintaining confidentiality.","AI & Machine Learning"
"mRNA Technology Expands Beyond COVID Vaccines","Building on COVID-19 vaccine success, biotech companies are developing mRNA therapies for cancer, heart disease, and rare genetic disorders. The platform's flexibility allows rapid design of treatments targeting specific disease mechanisms. Clinical trials show promising results for personalized cancer vaccines and treatments for previously untreatable genetic conditions.","Healthcare & Biotech"
"Topological Quantum Computing Approach Shows Stability","Microsoft and academic partners report progress on topological qubits, a quantum computing approach promising inherent error resistance. Unlike conventional qubits that require extensive error correction, topological qubits maintain quantum states through their mathematical properties. If successful, this could enable scalable quantum computers without massive overhead for error correction.","Quantum Computing"
"Supply Chain Attacks Become Primary Cybersecurity Threat","Hackers increasingly target software supply chains, compromising trusted vendors to infiltrate thousands of downstream organizations. Recent attacks have affected government agencies, corporations, and critical infrastructure through compromised software updates. Security experts call for enhanced vetting of third-party software and adoption of secure software supply chain practices.","Cybersecurity"
"Explainable AI Makes Black Box Models Transparent","Researchers develop techniques to interpret and explain decisions made by complex neural networks, addressing the black box problem in AI. These explainability methods reveal which features influence model predictions, building trust and enabling error diagnosis. Regulators are mandating explainable AI in high-stakes domains like healthcare, criminal justice, and financial services.","AI & Machine Learning"
"Microbiome Therapies Treat Chronic Diseases","Scientists are harnessing the human microbiome to treat conditions from inflammatory bowel disease to depression. Fecal microbiota transplants and designer probiotic cocktails restore healthy bacterial communities, addressing root causes rather than symptoms. Clinical trials show microbiome interventions can be more effective than traditional drugs with fewer side effects.","Healthcare & Biotech"
"Room-Temperature Superconductor Claim Under Scrutiny","Physicists debate controversial claims of a material exhibiting superconductivity at room temperature and atmospheric pressure. If verified, this would revolutionize electronics, energy transmission, and quantum computing by eliminating the need for expensive cooling systems. Independent laboratories are attempting to replicate the results amid scientific skepticism.","Quantum Computing"
"AI-Generated Phishing Emails Evade Detection Systems","Cybercriminals leverage language models to create highly convincing phishing emails that bypass spam filters and fool recipients. These AI-generated messages mimic writing styles, reference recent events, and personalize content at scale. Cybersecurity firms are developing AI-powered detection systems in an escalating arms race between attackers and defenders.","Cybersecurity"
"Self-Supervised Learning Reduces Need for Labeled Data","New self-supervised learning approaches enable AI to learn from unlabeled data, dramatically reducing the cost and effort of training advanced models. These techniques have achieved state-of-the-art results in computer vision, natural language processing, and robotics. The breakthrough democratizes AI development by removing the bottleneck of manual data labeling.","AI & Machine Learning"
"Longevity Research Identifies Cellular Aging Mechanisms","Breakthroughs in understanding cellular senescence reveal targetable mechanisms of aging. Researchers have identified compounds that clear senescent cells, demonstrating lifespan extension and healthspan improvements in animal models. Human trials are underway for therapies that could delay age-related diseases and extend healthy years of life.","Healthcare & Biotech"
"Quantum Simulation Models Complex Chemical Reactions","Quantum computers successfully simulate chemical reactions too complex for classical computers, enabling rational design of catalysts and materials. These simulations model electron interactions with unprecedented accuracy, predicting reaction outcomes and identifying optimal conditions. Applications include developing efficient batteries, carbon capture materials, and sustainable chemical processes.","Quantum Computing"
"Critical Infrastructure Faces Increasing Cyber Threats","Energy grids, water systems, and transportation networks face sophisticated cyberattacks from nation-state actors. Recent incidents have disrupted services to millions, demonstrating the vulnerability of essential infrastructure. Governments are mandating cybersecurity upgrades and information sharing to protect critical systems from escalating threats.","Cybersecurity"
"Multi-Modal AI Combines Vision, Language, and Audio","Advanced AI systems process and generate content across multiple modalities, understanding relationships between images, text, and sound. These models can describe images in natural language, generate images from text, and create synchronized audio-visual content. Applications span accessibility tools, content creation, and human-computer interaction.","AI & Machine Learning"
"Organoid Technology Revolutionizes Drug Testing","Laboratory-grown miniature organs called organoids provide realistic models for testing drug safety and efficacy. These 3D tissue cultures better predict human responses than traditional cell cultures or animal models, accelerating drug development while reducing animal testing. Pharmaceutical companies are integrating organoid screening into their development pipelines.","Healthcare & Biotech"
"Quantum Cryptography Secures Government Communications","Several nations deploy quantum key distribution networks for secure government communications immune to current and future decryption methods. The technology uses quantum mechanics principles to detect any interception attempts, ensuring absolute security. As quantum computers threaten conventional encryption, quantum cryptography provides a future-proof security solution.","Quantum Computing"
"Insider Threats Emerge as Top Cybersecurity Risk","Organizations identify insider threats—employees or contractors misusing access privileges—as a growing security challenge. These incidents cause greater damage than external attacks due to legitimate access and deep system knowledge. Companies implement behavioral analytics, access controls, and security culture programs to detect and prevent insider threats.","Cybersecurity"
"AI Tutoring Systems Personalize Education at Scale","Intelligent tutoring systems use AI to adapt instruction to individual student needs, providing personalized feedback and pacing. Studies show AI tutors improve learning outcomes comparable to human one-on-one instruction. The technology promises to democratize access to high-quality education and address teacher shortages in underserved areas.","AI & Machine Learning"
"Gene Editing Cures Sickle Cell Disease in Clinical Trial","Patients with sickle cell disease achieve complete remission following CRISPR gene editing treatment. The therapy corrects the genetic mutation causing the disease, eliminating painful crises and transfusion needs. Success in this trial paves the way for gene editing treatments of thousands of genetic disorders affecting millions worldwide.","Healthcare & Biotech"
"Quantum Annealing Optimizes Complex Logistics Problems","Companies deploy quantum annealers to solve optimization problems in logistics, scheduling, and resource allocation. These specialized quantum computers find near-optimal solutions to problems intractable for classical algorithms. Early adopters report significant cost savings and efficiency improvements in supply chain management and route planning.","Quantum Computing"
"Cloud Security Breaches Expose Millions of Records","Misconfigured cloud storage accounts lead to massive data breaches exposing sensitive information of millions. Security audits reveal widespread lack of basic cloud security practices despite readily available tools. Cloud providers and enterprises are implementing automated security monitoring and configuration management to prevent exposure of sensitive data.","Cybersecurity"
"Neuromorphic Computing Mimics Brain Architecture","Engineers develop computer chips that mimic biological neural networks, achieving brain-like efficiency and capabilities. These neuromorphic processors excel at pattern recognition and learning tasks while consuming a fraction of the power of conventional AI accelerators. Applications include edge AI for robotics, autonomous vehicles, and Internet of Things devices.","AI & Machine Learning"
"Immunotherapy Breakthrough Treats Solid Tumors","New immunotherapy approaches show efficacy against solid tumors previously resistant to treatment. The therapies enhance the immune system's ability to recognize and destroy cancer cells hidden within tumor masses. Clinical trials report durable responses in patients with advanced cancers, offering hope where conventional treatments have failed.","Healthcare & Biotech"
"Quantum Computing Threatens Current Encryption Standards","Cybersecurity experts warn that quantum computers will break widely used encryption methods protecting financial transactions, government secrets, and personal data. The timeline for quantum computers capable of cracking RSA encryption has shortened to 10-15 years. Organizations must begin transitioning to quantum-resistant encryption algorithms to protect data for decades ahead.","Quantum Computing"
"Social Engineering Attacks Exploit Human Psychology","Cybercriminals increasingly use psychological manipulation tactics to trick employees into bypassing security controls. These social engineering attacks succeed where technical measures fail, making human behavior the weakest security link. Organizations implement security awareness training and simulated phishing campaigns to build employee resilience against manipulation.","Cybersecurity"
"AI Detects Early Signs of Mental Health Conditions","Machine learning models analyze speech patterns, social media activity, and smartphone usage to identify early warning signs of depression, anxiety, and other mental health conditions. Early detection enables timely intervention before conditions worsen. Privacy-preserving deployment of these tools could help address the growing mental health crisis through accessible screening.","AI & Machine Learning"
"Nanotechnology Delivers Drugs Directly to Cancer Cells","Researchers develop nanoparticles that deliver chemotherapy drugs specifically to cancer cells while sparing healthy tissue. The nanocarriers recognize cancer cell markers and release drugs only at tumor sites, dramatically reducing side effects. This targeted approach allows higher effective drug doses with better tolerance and outcomes.","Healthcare & Biotech"
"Quantum Sensors Detect Dark Matter Candidates","Ultra-sensitive quantum sensors search for dark matter particles, one of physics' greatest mysteries. These devices exploit quantum coherence to detect minute interactions between dark matter and ordinary matter. Early experiments show promising signals that could finally reveal the nature of dark matter comprising 85% of the universe's mass.","Quantum Computing"
"Deepfake Technology Poses New Cybersecurity Challenge","Synthetic media created by AI enables convincing fake videos and audio recordings of real people. Criminals use deepfakes for fraud, extortion, and disinformation campaigns. Detection technology struggles to keep pace with deepfake sophistication, prompting calls for digital authentication standards and legal frameworks.","Cybersecurity"
"Transfer Learning Accelerates AI Development","AI researchers leverage transfer learning to adapt pre-trained models to new tasks with minimal additional training. This approach dramatically reduces the data, computation, and expertise required for developing high-performance AI systems. Transfer learning has accelerated progress across computer vision, natural language processing, and scientific applications.","AI & Machine Learning"
"Regenerative Medicine Repairs Heart Damage","Stem cell therapies show promise in repairing heart tissue damaged by heart attacks. Researchers inject specialized cells that regenerate cardiac muscle and blood vessels, restoring heart function. Clinical trials demonstrate improved heart function and reduced mortality in patients who received the treatment compared to standard care.","Healthcare & Biotech"
